{
  "domain":"electrical","version":"1.0.0","status":"project-authored-reference-aligned",
  "standardReferences":["IEC 60617:2026 DB","ISO 14617-1:2025"],
  "symbols":[
    {"id":"electrical.battery","domain":"electrical","name":"Battery","aliases":["DC source"],"tags":["source","power"],"terminals":[{"id":"positive","x":15,"y":50},{"id":"negative","x":85,"y":50}],"primitives":[{"type":"line","attrs":{"x1":38,"y1":22,"x2":38,"y2":78},"className":"symbol-stroke"},{"type":"line","attrs":{"x1":58,"y1":32,"x2":58,"y2":68},"className":"symbol-stroke"},{"type":"line","attrs":{"x1":15,"y1":50,"x2":38,"y2":50},"className":"symbol-stroke"},{"type":"line","attrs":{"x1":58,"y1":50,"x2":85,"y2":50},"className":"symbol-stroke"}]},
    {"id":"electrical.fuse","domain":"electrical","name":"Fuse","tags":["protection"],"terminals":[{"id":"in","x":10,"y":50},{"id":"out","x":90,"y":50}],"primitives":[{"type":"line","attrs":{"x1":10,"y1":50,"x2":28,"y2":50},"className":"symbol-stroke"},{"type":"rect","attrs":{"x":28,"y":36,"width":44,"height":28,"rx":3},"className":"symbol-fill"},{"type":"path","attrs":{"d":"M34 56 L44 44 L56 56 L66 44"},"className":"symbol-stroke"},{"type":"line","attrs":{"x1":72,"y1":50,"x2":90,"y2":50},"className":"symbol-stroke"}]},
    {"id":"electrical.resistor","domain":"electrical","name":"Resistor","tags":["passive"],"terminals":[{"id":"a","x":10,"y":50},{"id":"b","x":90,"y":50}],"primitives":[{"type":"line","attrs":{"x1":10,"y1":50,"x2":25,"y2":50},"className":"symbol-stroke"},{"type":"path","attrs":{"d":"M25 50 L32 38 L42 62 L52 38 L62 62 L72 38 L78 50"},"className":"symbol-stroke"},{"type":"line","attrs":{"x1":78,"y1":50,"x2":90,"y2":50},"className":"symbol-stroke"}]},
    {"id":"electrical.lamp","domain":"electrical","name":"Lamp / generic load","aliases":["bulb","load"],"tags":["load"],"terminals":[{"id":"a","x":10,"y":50},{"id":"b","x":90,"y":50}],"primitives":[{"type":"line","attrs":{"x1":10,"y1":50,"x2":25,"y2":50},"className":"symbol-stroke"},{"type":"circle","attrs":{"cx":50,"cy":50,"r":25},"className":"symbol-fill"},{"type":"line","attrs":{"x1":34,"y1":34,"x2":66,"y2":66},"className":"symbol-stroke"},{"type":"line","attrs":{"x1":66,"y1":34,"x2":34,"y2":66},"className":"symbol-stroke"},{"type":"line","attrs":{"x1":75,"y1":50,"x2":90,"y2":50},"className":"symbol-stroke"}]},
    {"id":"electrical.ground","domain":"electrical","name":"Chassis ground","aliases":["ground","earth return"],"tags":["return"],"terminals":[{"id":"ground","x":50,"y":10}],"primitives":[{"type":"line","attrs":{"x1":50,"y1":10,"x2":50,"y2":52},"className":"symbol-stroke"},{"type":"line","attrs":{"x1":24,"y1":52,"x2":76,"y2":52},"className":"symbol-stroke"},{"type":"line","attrs":{"x1":32,"y1":62,"x2":68,"y2":62},"className":"symbol-stroke"},{"type":"line","attrs":{"x1":40,"y1":72,"x2":60,"y2":72},"className":"symbol-stroke"}]},
    {"id":"electrical.switch-no","domain":"electrical","name":"Normally open switch","aliases":["NO switch"],"tags":["switching","control"],"terminals":[{"id":"a","x":10,"y":50},{"id":"b","x":90,"y":50}],"primitives":[{"type":"line","attrs":{"x1":10,"y1":50,"x2":35,"y2":50},"className":"symbol-stroke"},{"type":"circle","attrs":{"cx":35,"cy":50,"r":3},"className":"symbol-fill"},{"type":"circle","attrs":{"cx":70,"cy":50,"r":3},"className":"symbol-fill"},{"type":"line","attrs":{"x1":38,"y1":47,"x2":66,"y2":32},"className":"symbol-stroke"},{"type":"line","attrs":{"x1":73,"y1":50,"x2":90,"y2":50},"className":"symbol-stroke"}]},
    {"id":"electrical.relay-coil","domain":"electrical","name":"Relay coil","tags":["relay","control"],"terminals":[{"id":"a","x":10,"y":50},{"id":"b","x":90,"y":50}],"primitives":[{"type":"line","attrs":{"x1":10,"y1":50,"x2":30,"y2":50},"className":"symbol-stroke"},{"type":"rect","attrs":{"x":30,"y":30,"width":40,"height":40,"rx":5},"className":"symbol-fill"},{"type":"line","attrs":{"x1":70,"y1":50,"x2":90,"y2":50},"className":"symbol-stroke"}]},
    {"id":"electrical.motor","domain":"electrical","name":"Electric motor","tags":["motor","load"],"terminals":[{"id":"a","x":10,"y":50},{"id":"b","x":90,"y":50}],"primitives":[{"type":"line","attrs":{"x1":10,"y1":50,"x2":25,"y2":50},"className":"symbol-stroke"},{"type":"circle","attrs":{"cx":50,"cy":50,"r":25},"className":"symbol-fill"},{"type":"text","attrs":{"x":50,"y":56,"text-anchor":"middle"},"text":"M","className":"symbol-text"},{"type":"line","attrs":{"x1":75,"y1":50,"x2":90,"y2":50},"className":"symbol-stroke"}]},
    {"id":"electrical.alternator","domain":"electrical","name":"Alternator / generator","tags":["generation","charging"],"terminals":[{"id":"output","x":90,"y":50},{"id":"ground","x":50,"y":90}],"primitives":[{"type":"circle","attrs":{"cx":50,"cy":50,"r":28},"className":"symbol-fill"},{"type":"path","attrs":{"d":"M30 50 C36 35 44 35 50 50 S64 65 70 50"},"className":"symbol-stroke"},{"type":"line","attrs":{"x1":78,"y1":50,"x2":90,"y2":50},"className":"symbol-stroke"},{"type":"line","attrs":{"x1":50,"y1":78,"x2":50,"y2":90},"className":"symbol-stroke"}]},
    {"id":"electrical.test-point","domain":"electrical","name":"Test point","tags":["measurement","diagnostics"],"terminals":[{"id":"node","x":50,"y":50}],"primitives":[{"type":"circle","attrs":{"cx":50,"cy":50,"r":9},"className":"symbol-fill"},{"type":"circle","attrs":{"cx":50,"cy":50,"r":3},"className":"symbol-solid"}]}
  ]
}

