{
  "domain":"hydraulic","version":"1.0.0","status":"project-authored-reference-aligned",
  "standardReferences":["ISO 1219-1:2012","ISO 1219-1:2012/Amd 1:2016","ISO 14617-1:2025"],
  "symbols":[
    {"id":"hydraulic.reservoir","domain":"hydraulic","name":"Reservoir / tank","tags":["storage","return"],"terminals":[{"id":"port","x":50,"y":15}],"primitives":[{"type":"path","attrs":{"d":"M20 20 V78 H80 V20"},"className":"symbol-stroke"},{"type":"line","attrs":{"x1":20,"y1":68,"x2":80,"y2":68},"className":"symbol-fluid"},{"type":"line","attrs":{"x1":50,"y1":15,"x2":50,"y2":36},"className":"symbol-stroke"}]},
    {"id":"hydraulic.pump-fixed","domain":"hydraulic","name":"Fixed-displacement pump","aliases":["hydraulic pump"],"tags":["pump","source"],"terminals":[{"id":"inlet","x":10,"y":50},{"id":"outlet","x":90,"y":50}],"primitives":[{"type":"line","attrs":{"x1":10,"y1":50,"x2":22,"y2":50},"className":"symbol-stroke"},{"type":"circle","attrs":{"cx":50,"cy":50,"r":28},"className":"symbol-fill"},{"type":"polygon","attrs":{"points":"38,62 66,50 38,38"},"className":"symbol-solid"},{"type":"line","attrs":{"x1":78,"y1":50,"x2":90,"y2":50},"className":"symbol-stroke"}]},
    {"id":"hydraulic.motor-fixed","domain":"hydraulic","name":"Fixed-displacement hydraulic motor","tags":["motor","actuator"],"terminals":[{"id":"a","x":10,"y":50},{"id":"b","x":90,"y":50}],"primitives":[{"type":"line","attrs":{"x1":10,"y1":50,"x2":22,"y2":50},"className":"symbol-stroke"},{"type":"circle","attrs":{"cx":50,"cy":50,"r":28},"className":"symbol-fill"},{"type":"polygon","attrs":{"points":"64,62 36,50 64,38"},"className":"symbol-solid"},{"type":"line","attrs":{"x1":78,"y1":50,"x2":90,"y2":50},"className":"symbol-stroke"}]},
    {"id":"hydraulic.cylinder-double","domain":"hydraulic","name":"Double-acting cylinder","tags":["linear actuator","cylinder"],"terminals":[{"id":"cap","x":10,"y":35},{"id":"rod","x":10,"y":65}],"primitives":[{"type":"rect","attrs":{"x":22,"y":25,"width":52,"height":50},"className":"symbol-fill"},{"type":"line","attrs":{"x1":52,"y1":25,"x2":52,"y2":75},"className":"symbol-stroke"},{"type":"line","attrs":{"x1":52,"y1":50,"x2":90,"y2":50},"className":"symbol-stroke"},{"type":"line","attrs":{"x1":10,"y1":35,"x2":22,"y2":35},"className":"symbol-stroke"},{"type":"line","attrs":{"x1":10,"y1":65,"x2":22,"y2":65},"className":"symbol-stroke"}]},
    {"id":"hydraulic.check-valve","domain":"hydraulic","name":"Check valve","aliases":["non-return valve"],"tags":["valve","one-way"],"terminals":[{"id":"in","x":10,"y":50},{"id":"out","x":90,"y":50}],"primitives":[{"type":"line","attrs":{"x1":10,"y1":50,"x2":30,"y2":50},"className":"symbol-stroke"},{"type":"polygon","attrs":{"points":"30,35 58,50 30,65"},"className":"symbol-stroke"},{"type":"line","attrs":{"x1":62,"y1":34,"x2":62,"y2":66},"className":"symbol-stroke"},{"type":"line","attrs":{"x1":62,"y1":50,"x2":90,"y2":50},"className":"symbol-stroke"}]},
    {"id":"hydraulic.relief-valve","domain":"hydraulic","name":"Pressure relief valve","tags":["valve","pressure","protection"],"terminals":[{"id":"pressure","x":10,"y":50},{"id":"tank","x":90,"y":50}],"primitives":[{"type":"line","attrs":{"x1":10,"y1":50,"x2":28,"y2":50},"className":"symbol-stroke"},{"type":"rect","attrs":{"x":28,"y":28,"width":44,"height":44},"className":"symbol-fill"},{"type":"line","attrs":{"x1":36,"y1":62,"x2":64,"y2":38},"className":"symbol-stroke"},{"type":"polyline","attrs":{"points":"40,24 44,18 48,24 52,18 56,24"},"className":"symbol-stroke"},{"type":"line","attrs":{"x1":72,"y1":50,"x2":90,"y2":50},"className":"symbol-stroke"}]},
    {"id":"hydraulic.directional-4-3","domain":"hydraulic","name":"4/3 directional control valve","aliases":["four-way three-position valve"],"tags":["valve","directional control"],"terminals":[{"id":"p","x":35,"y":90},{"id":"t","x":65,"y":90},{"id":"a","x":35,"y":10},{"id":"b","x":65,"y":10}],"primitives":[{"type":"rect","attrs":{"x":20,"y":25,"width":60,"height":50},"className":"symbol-fill"},{"type":"line","attrs":{"x1":40,"y1":25,"x2":40,"y2":75},"className":"symbol-stroke"},{"type":"line","attrs":{"x1":60,"y1":25,"x2":60,"y2":75},"className":"symbol-stroke"},{"type":"line","attrs":{"x1":35,"y1":10,"x2":35,"y2":25},"className":"symbol-stroke"},{"type":"line","attrs":{"x1":65,"y1":10,"x2":65,"y2":25},"className":"symbol-stroke"},{"type":"line","attrs":{"x1":35,"y1":75,"x2":35,"y2":90},"className":"symbol-stroke"},{"type":"line","attrs":{"x1":65,"y1":75,"x2":65,"y2":90},"className":"symbol-stroke"},{"type":"path","attrs":{"d":"M24 64 L36 36 M36 36 L31 39 M36 36 L34 42 M64 64 L76 36 M76 36 L71 39 M76 36 L74 42"},"className":"symbol-stroke"},{"type":"line","attrs":{"x1":45,"y1":38,"x2":55,"y2":62},"className":"symbol-stroke"},{"type":"line","attrs":{"x1":55,"y1":38,"x2":45,"y2":62},"className":"symbol-stroke"}]},
    {"id":"hydraulic.filter","domain":"hydraulic","name":"Hydraulic filter","tags":["filter","conditioning"],"terminals":[{"id":"in","x":10,"y":50},{"id":"out","x":90,"y":50}],"primitives":[{"type":"line","attrs":{"x1":10,"y1":50,"x2":25,"y2":50},"className":"symbol-stroke"},{"type":"rect","attrs":{"x":25,"y":25,"width":50,"height":50},"className":"symbol-fill"},{"type":"line","attrs":{"x1":30,"y1":70,"x2":70,"y2":30},"className":"symbol-stroke"},{"type":"line","attrs":{"x1":75,"y1":50,"x2":90,"y2":50},"className":"symbol-stroke"}]},
    {"id":"hydraulic.accumulator","domain":"hydraulic","name":"Hydraulic accumulator","tags":["storage","pressure"],"terminals":[{"id":"port","x":50,"y":90}],"primitives":[{"type":"circle","attrs":{"cx":50,"cy":48,"r":28},"className":"symbol-fill"},{"type":"line","attrs":{"x1":22,"y1":48,"x2":78,"y2":48},"className":"symbol-stroke"},{"type":"line","attrs":{"x1":50,"y1":76,"x2":50,"y2":90},"className":"symbol-stroke"}]},
    {"id":"hydraulic.pressure-gauge","domain":"hydraulic","name":"Pressure gauge","tags":["measurement","pressure"],"terminals":[{"id":"port","x":50,"y":90}],"primitives":[{"type":"circle","attrs":{"cx":50,"cy":46,"r":27},"className":"symbol-fill"},{"type":"line","attrs":{"x1":50,"y1":46,"x2":65,"y2":32},"className":"symbol-stroke"},{"type":"line","attrs":{"x1":50,"y1":73,"x2":50,"y2":90},"className":"symbol-stroke"}]},
    {"id":"hydraulic.flow-control","domain":"hydraulic","name":"Adjustable flow control","tags":["flow","valve","restriction"],"terminals":[{"id":"in","x":10,"y":50},{"id":"out","x":90,"y":50}],"primitives":[{"type":"line","attrs":{"x1":10,"y1":50,"x2":30,"y2":50},"className":"symbol-stroke"},{"type":"polygon","attrs":{"points":"30,35 50,50 30,65"},"className":"symbol-stroke"},{"type":"polygon","attrs":{"points":"70,35 50,50 70,65"},"className":"symbol-stroke"},{"type":"line","attrs":{"x1":70,"y1":50,"x2":90,"y2":50},"className":"symbol-stroke"},{"type":"line","attrs":{"x1":32,"y1":72,"x2":68,"y2":28},"className":"symbol-stroke"},{"type":"polyline","attrs":{"points":"60,30 68,28 66,36"},"className":"symbol-stroke"}]}
  ]
}
